Key,Issue Type,Parent,Summary,Status,Assignee,Start date,Inferred start date,Due date,Inferred due date,Issue color
FRBP2-13,Epic,,Prompt Versioning & Management System,To Do,,,,,,purple
FRBP2-25,Task,FRBP2-13,Create prompt versioning database schema,To Do,,,,,,purple
FRBP2-26,Task,FRBP2-13,Create prompt management service,To Do,,,,,,purple
FRBP2-27,Task,FRBP2-13,Add prompt version tracking to query logs,To Do,,,,,,purple
FRBP2-28,Task,FRBP2-13,Create admin API endpoints for prompt management,To Do,,,,,,purple
FRBP2-29,Task,FRBP2-13,Add prompt version to configuration,To Do,,,,,,purple
FRBP2-14,Epic,,Sentry Integration with Prompt Breadcrumbs,To Do,,,,,,purple
FRBP2-30,Task,FRBP2-14,Add Sentry breadcrumbs for prompt execution,To Do,,,,,,purple
FRBP2-31,Task,FRBP2-14,Add custom Sentry tags for prompts,To Do,,,,,,purple
FRBP2-32,Task,FRBP2-14,Create prompt-specific Sentry context,To Do,,,,,,purple
FRBP2-33,Task,FRBP2-14,Add performance tracking for prompts,To Do,,,,,,purple
FRBP2-15,Epic,,Prompt Context Injection & Templating System,To Do,,,,,,purple
FRBP2-34,Task,FRBP2-15,Create dynamic context injection service,To Do,,,,,,purple
FRBP2-35,Task,FRBP2-15,Add context injection to RAG pipeline,To Do,,,,,,purple
FRBP2-36,Task,FRBP2-15,Create prompt template system,To Do,,,,,,purple
FRBP2-37,Task,FRBP2-15,Modularize prompts into reusable components,To Do,,,,,,purple
FRBP2-16,Epic,,Prompt Engineering & Optimization Framework,To Do,,,,,,purple
FRBP2-38,Task,FRBP2-16,Create prompt testing framework,To Do,,,,,,purple
FRBP2-39,Task,FRBP2-16,Add prompt analytics dashboard,To Do,,,,,,purple
FRBP2-40,Task,FRBP2-16,Create prompt optimization workflow,To Do,,,,,,purple
FRBP2-17,Epic,,Enhanced Document Management System,To Do,,,,,,purple
FRBP2-41,Task,FRBP2-17,Add document versioning,To Do,,,,,,purple
FRBP2-42,Task,FRBP2-17,Improve document metadata tracking,To Do,,,,,,purple
FRBP2-43,Task,FRBP2-17,Add document search and filtering,To Do,,,,,,purple
FRBP2-44,Task,FRBP2-17,Create document analytics,To Do,,,,,,purple
FRBP2-18,Epic,,Vena API Integration & Data Pulling,To Do,,,,,,purple
FRBP2-45,Task,FRBP2-18,Enhance Vena API client with additional endpoints,To Do,,,,,,purple
FRBP2-46,Task,FRBP2-18,Create data synchronization service,To Do,,,,,,purple
FRBP2-47,Task,FRBP2-18,Implement intelligent caching for Vena API data,To Do,,,,,,purple
FRBP2-48,Task,FRBP2-18,Add model ID management system,To Do,,,,,,purple
FRBP2-49,Task,FRBP2-18,Create data transformation and formatting service,To Do,,,,,,purple
FRBP2-50,Task,FRBP2-18,Enhance error handling and retry logic,To Do,,,,,,purple
FRBP2-51,Task,FRBP2-18,Add real-time data update capabilities,To Do,,,,,,purple
FRBP2-52,Task,FRBP2-18,Create Vena API analytics and monitoring,To Do,,,,,,purple
FRBP2-19,Epic,,LLM Provider Compatibility Fixes,To Do,,,,,,purple
FRBP2-53,Task,FRBP2-19,Update cache keys to include LLM provider,To Do,,,,,,purple
FRBP2-54,Task,FRBP2-19,Add LLM provider/model tracking to query logs,To Do,,,,,,purple
FRBP2-55,Task,FRBP2-19,Add provider-specific analytics,To Do,,,,,,purple
FRBP2-56,Task,FRBP2-19,Add provider-specific error handling,To Do,,,,,,purple
FRBP2-57,Task,FRBP2-19,Add error recovery strategies,To Do,,,,,,purple
FRBP2-20,Epic,,Infrastructure & Code Quality Improvements,To Do,,,,,,purple
FRBP2-58,Task,FRBP2-20,Verify embeddings still work correctly,To Do,,,,,,purple
FRBP2-59,Task,FRBP2-20,Check for hardcoded model references,To Do,,,,,,purple
FRBP2-60,Task,FRBP2-20,Ensure ingestion doesn't depend on LLM provider,To Do,,,,,,purple
FRBP2-61,Task,FRBP2-20,Add ingestion performance metrics,To Do,,,,,,purple
FRBP2-62,Task,FRBP2-20,Search codebase for hardcoded model names,To Do,,,,,,purple
FRBP2-63,Task,FRBP2-20,Replace with configuration-based references,To Do,,,,,,purple
FRBP2-64,Task,FRBP2-20,Update documentation with model references,To Do,,,,,,purple
FRBP2-21,Epic,,Testing & Quality Assurance,To Do,,,,,,purple
FRBP2-65,Task,FRBP2-21,Create test cases for prompt variations,To Do,,,,,,purple
FRBP2-66,Task,FRBP2-21,Automated prompt evaluation,To Do,,,,,,purple
FRBP2-67,Task,FRBP2-21,Regression testing for prompt changes,To Do,,,,,,purple
FRBP2-22,Epic,,Documentation & Knowledge Base Updates,To Do,,,,,,purple
FRBP2-68,Task,FRBP2-22,Document prompt versioning system,To Do,,,,,,purple
FRBP2-69,Task,FRBP2-22,Document Sentry breadcrumb structure,To Do,,,,,,purple
FRBP2-70,Task,FRBP2-22,Document context injection system,To Do,,,,,,purple
FRBP2-71,Task,FRBP2-22,Update API documentation,To Do,,,,,,purple
FRBP2-23,Epic,,Advanced Prompt Features,To Do,,,,,,purple
FRBP2-72,Task,FRBP2-23,Multi-turn conversation context in prompts,To Do,,,,,,purple
FRBP2-73,Task,FRBP2-23,Dynamic few-shot example selection,To Do,,,,,,purple
FRBP2-74,Task,FRBP2-23,Prompt templates for different query types,To Do,,,,,,purple
FRBP2-75,Task,FRBP2-23,Prompt personalization per user/tenant,To Do,,,,,,purple
FRBP2-24,Epic,,Monitoring & Analytics Dashboards,To Do,,,,,,purple
FRBP2-76,Task,FRBP2-24,Prompt performance dashboards,To Do,,,,,,purple
FRBP2-77,Task,FRBP2-24,Real-time prompt monitoring,To Do,,,,,,purple
FRBP2-78,Task,FRBP2-24,Alerting for prompt degradation,To Do,,,,,,purple
FRBP2-79,Task,FRBP2-24,Cost tracking per prompt version,To Do,,,,,,purple
FRBP2-105,Epic,,GDPR Compliance Implementation,To Do,,,,,,purple
FRBP2-173,Task,FRBP2-105,REQ-001: Data Subject Rights Implementation,To Do,,,,,,purple
FRBP2-174,Task,FRBP2-105,REQ-002: Automated Data Retention and Deletion,To Do,,,,,,purple
FRBP2-175,Task,FRBP2-105,REQ-003: Consent Mechanism,To Do,,,,,,purple
FRBP2-176,Task,FRBP2-105,REQ-004: Third-Party Data Processing Agreement Verification,To Do,,,,,,purple
FRBP2-177,Task,FRBP2-105,REQ-005: Right to Restriction of Processing,To Do,,,,,,purple
FRBP2-178,Task,FRBP2-105,REQ-006: Right to Object,To Do,,,,,,purple
FRBP2-179,Task,FRBP2-105,REQ-007: Data Breach Notification Procedures,To Do,,,,,,purple
FRBP2-180,Task,FRBP2-105,REQ-008: Security Verification and Documentation,To Do,,,,,,purple
FRBP2-181,Task,FRBP2-105,REQ-009: Processing Activities Register (ROPA),To Do,,,,,,purple
FRBP2-182,Task,FRBP2-105,REQ-010: Data Minimisation Review,To Do,,,,,,purple
FRBP2-183,Task,FRBP2-105,REQ-011: Audit Logging,To Do,,,,,,purple
FRBP2-184,Task,FRBP2-105,REQ-012: Data Protection Impact Assessment (DPIA),To Do,,,,,,purple
,Epic,,RAG Evaluation Framework & Quality Metrics,To Do,,,,,,purple
,Task,RAG Evaluation Framework & Quality Metrics,Implement similarity score logging,To Do,,,,,,purple
,Task,RAG Evaluation Framework & Quality Metrics,Implement recall@k for gold queries,To Do,,,,,,purple
,Task,RAG Evaluation Framework & Quality Metrics,Add latency & cost tracking,To Do,,,,,,purple
,Task,RAG Evaluation Framework & Quality Metrics,Create evaluation service module,To Do,,,,,,purple
,Task,RAG Evaluation Framework & Quality Metrics,Implement self-consistency entropy (CE proxy),To Do,,,,,,purple
,Task,RAG Evaluation Framework & Quality Metrics,Implement hallucination detection,To Do,,,,,,purple
,Task,RAG Evaluation Framework & Quality Metrics,Create gold test set,To Do,,,,,,purple
,Task,RAG Evaluation Framework & Quality Metrics,Implement drift metrics,To Do,,,,,,purple
,Task,RAG Evaluation Framework & Quality Metrics,Create evaluation runner script,To Do,,,,,,purple
,Task,RAG Evaluation Framework & Quality Metrics,Implement CSV export,To Do,,,,,,purple
,Task,RAG Evaluation Framework & Quality Metrics,Integration with RAG pipeline,To Do,,,,,,purple
,Task,RAG Evaluation Framework & Quality Metrics,Document metric definitions,To Do,,,,,,purple
,Task,RAG Evaluation Framework & Quality Metrics,Create unit tests,To Do,,,,,,purple
,Task,RAG Evaluation Framework & Quality Metrics,Integration testing,To Do,,,,,,purple
